{
  "schema_version": "1.0.0",
  "created_at": "2026-07-26T12:00:00Z",
  "correlation_id": "corr_drl_demo_0001",
  "trace_id": "trace_drl_demo_0001",
  "id": "policy_drl_demo_0001",
  "run_id": "run_drl_demo_0001",
  "tool_call_id": "call_drl_demo_0001",
  "decision": "allow",
  "risk_tier": "R0",
  "policy_version": "1.0.0",
  "matched_rules": [
    "public-read-only"
  ],
  "required_approval_scopes": [],
  "reason_code": "PUBLIC_READ_ONLY_ALLOWED",
  "safe_explanation": "The requested tool reads only public DRL documentation.",
  "expires_at": "2026-07-26T12:02:00Z"
}
